{
  "$schema": "../../_schema/microcopy.schema.json",
  "$locale": "pa",
  "$direction": "ltr",
  "$status": "stub — awaiting native steward review",
  "$plural_rules": "Punjabi: 2 categories (one, other)",
  "$script": "Gurmukhi (East Punjabi, India) is canonical for v1; Shahmukhi (West Punjabi, Pakistan, RTL) is a separate locale code (`pa-PK`).",
  "$canonical_source": "../../../docs/part-14-content-design.md §2 microcopy patterns",

  "common": {
    "save":             "{TODO: native review — ਸੰਭਾਲੋ}",
    "cancel":           "{TODO: native review — ਰੱਦ ਕਰੋ}",
    "delete":           "{TODO: native review — ਮਿਟਾਓ}",
    "edit":             "{TODO: native review — ਸੋਧੋ}",
    "close":            "{TODO: native review — ਬੰਦ ਕਰੋ}",
    "ok":               "{TODO: native review — ਠੀਕ}",
    "yes":              "{TODO: native review — ਹਾਂ}",
    "no":               "{TODO: native review — ਨਹੀਂ}",
    "loading":          "{TODO: native review — ਲੋਡ ਹੋ ਰਿਹਾ ਹੈ…}",
    "search":           "{TODO: native review — ਖੋਜ}"
  },

  "errors": {
    "generic":          "{TODO: native review}",
    "network":          "{TODO: native review}",
    "validation":       "{TODO: native review}",
    "permission":       "{TODO: native review}"
  },

  "empty_states": {
    "no_results":       "{TODO: native review}",
    "no_data":          "{TODO: native review}",
    "first_run":        "{TODO: native review}"
  },

  "auth": {
    "sign_in":          "{TODO: native review}",
    "sign_out":         "{TODO: native review}",
    "register":         "{TODO: native review}",
    "forgot_password":  "{TODO: native review}"
  },

  "$cultural_notes": {
    "diaspora_audience": "Punjabi has a major diaspora audience (UK, Canada, US). Steward should target India-Punjab idiom by default; UK / Canada Punjabi has noticeable code-switching.",
    "religious_diversity": "Punjabi speakers span Sikh, Hindu, Muslim communities. Avoid religious-specific imagery; default to neutral cultural references per Part 5 §14.",
    "Hindi_loanwords": "Many tech terms borrowed from Hindi or English; preserve where natural rather than coining new Punjabi terms."
  }
}
