{
  "$schema": "../../_schema/microcopy.schema.json",
  "$locale": "ur",
  "$direction": "rtl",
  "$status": "stub — awaiting native steward review (RTL specialist required)",
  "$plural_rules": "Urdu: 2 categories (one, other)",
  "$script": "Nastaliq (Urdu) — complex calligraphic script. Be Vietnamese Pro will not render correctly; specify Noto Nastaliq Urdu fallback. Test layout in pseudo-loc CI.",
  "$canonical_source": "../../../docs/part-14-content-design.md §2 microcopy patterns",
  "$rtl_notes": "Pairs with existing Arabic / Hebrew RTL handling in Part 5 §9 bidi guidance.",

  "common": {
    "save":             "{TODO: native review — محفوظ کریں}",
    "cancel":           "{TODO: native review — منسوخ کریں}",
    "delete":           "{TODO: native review — حذف کریں}",
    "edit":             "{TODO: native review — ترمیم کریں}",
    "close":            "{TODO: native review — بند کریں}",
    "ok":               "{TODO: native review — ٹھیک ہے}",
    "yes":              "{TODO: native review — جی ہاں}",
    "no":               "{TODO: native review — نہیں}",
    "loading":          "{TODO: native review — لوڈ ہو رہا ہے…}",
    "search":           "{TODO: native review — تلاش کریں}"
  },

  "errors": {
    "generic":          "{TODO: native review}",
    "network":          "{TODO: native review}",
    "validation":       "{TODO: native review}",
    "permission":       "{TODO: native review}"
  },

  "empty_states": {
    "no_results":       "{TODO: native review}",
    "no_data":          "{TODO: native review}",
    "first_run":        "{TODO: native review}"
  },

  "auth": {
    "sign_in":          "{TODO: native review}",
    "sign_out":         "{TODO: native review}",
    "register":         "{TODO: native review}",
    "forgot_password":  "{TODO: native review}"
  },

  "$cultural_notes": {
    "rtl_handling": "Per Part 5 §9 bidi guidance: ensure layout flips correctly; numerals stay LTR in mixed-direction text. Verify pseudo-loc + RTL toggle in Storybook.",
    "formality": "Urdu has multiple formality levels (aap / tum / tu). Customer-facing default is 'aap' (most respectful).",
    "religious_context": "Avoid imagery / colour combinations associated with religious symbolism. Per Part 5 §14 cultural taboos.",
    "regional": "Urdu in Pakistan vs India has subtle differences; steward should specify target (default: Pakistan).",
    "diacritics": "Nastaliq diacritics (zer, zabar, pesh) are typically omitted in modern UI text but preserved in long-form religious / educational content."
  }
}
